datetime,headline,url
Aug-15-25 Today 10:00AM,Trinity Biotech's Redesigned CGM Sensor Favored by New Clinical Data,https://finviz.com/news/141989/trinity-biotechs-redesigned-cgm-sensor-favored-by-new-clinical-data
2025-08-15 00:40:00,1 Healthcare Stock for Long-Term Investors and 2 We Ignore,https://finviz.com/news/141609/1-healthcare-stock-for-long-term-investors-and-2-we-ignore
2025-08-14 09:50:00,"HIV Diagnostics Company Evaluation Report 2025 | Abbott, Siemens Healthineers, and Thermo Fisher Scientific Lead the Market with Innovative Portfolios and Strategic Expansion",https://finance.yahoo.com/news/hiv-diagnostics-company-evaluation-report-135000492.html
2025-08-14 08:33:00,Abbott Taps Growing TMVR Market With Tendyne System,https://finviz.com/news/140682/abbott-taps-growing-tmvr-market-with-tendyne-system
2025-08-13 10:11:00,"Saudi Arabia Clinical Chemistry Analyzer Market Forecast and Company Analysis Report 2025-2033 Featuring Thermo Fisher Scientific, Abbott, Siemens, Danaher, J&J, Sysmex ADR, HORIBA, Hitachi",https://finance.yahoo.com/news/saudi-arabia-clinical-chemistry-analyzer-141100943.html
2025-08-13 09:21:00,"Saudi Arabia Blood Glucose Device Market Trends and Company Analysis Report 2025-2033 Featuring Abbott Laboratories, Medtronic, Dexcom, Braun, DarioHealth, Sanofi, Bionime, and Novo Nordisk",https://finance.yahoo.com/news/saudi-arabia-blood-glucose-device-132100152.html
2025-08-13 08:37:00,MDT Stock Trades Cheaper Than Peers Ahead of Q1 Earnings: Time to Buy?,https://finviz.com/news/139167/mdt-stock-trades-cheaper-than-peers-ahead-of-q1-earnings-time-to-buy
2025-08-12 05:37:00,"United States Epilepsy Drugs Market Trends and Company Analysis Report 2025-2033 Featuring Eisai, UCB, H. Lundbeck, GW Pharmaceuticals, Abbott, Alkem Laboratories, Bausch Health, GSK",https://finance.yahoo.com/news/united-states-epilepsy-drugs-market-093700701.html
2025-08-12 05:32:00,"US Personalized Medicine Market Trends and Company Analysis Report 2025-2033 Featuring Abbott, GE, Aadi Bioscience, Illumina, QIAGEN, Eli Lilly and Co, Takeda, AbbVie, F. Hoffmann-La Roche",https://finance.yahoo.com/news/us-personalized-medicine-market-trends-093200781.html
2025-08-12 04:49:00,"STD Diagnostic Market Forecast and Company Analysis Report 2025-2033 Featuring Siemens, Abbott, MedMira, QIAGEN, Danaher, F. Hoffmann-La Roche, Diasorin, BioMeriuex, Hologic, Bio-Rad Laboratories",https://finance.yahoo.com/news/std-diagnostic-market-forecast-company-084900364.html
2025-08-12 04:42:00,"US Durable Medical Equipment Market Forecast and Competitive Landscape Report 2025-2033 | Invacare, NOVA, Inogen, Thermo Fisher Scientific, Abbott, Medtronic, Baxter, B. Braun, Boston Scientific, BD",https://finance.yahoo.com/news/us-durable-medical-equipment-market-084200164.html
2025-08-11 12:07:00,Abbott Laboratories shows growth in core products amid market shifts,https://finance.yahoo.com/m/63c17d17-6ae9-3367-9056-63ab7fcf63a1/abbott-laboratories-shows.html
2025-08-11 10:02:00,SetPoint Medical secures $140M to fund neuromodulation for arthritis,https://finance.yahoo.com/m/4cde5fe3-e9f6-3842-aa4e-6b026fad7833/setpoint-medical-secures.html
2025-08-11 08:48:00,Are Wall Street Analysts Predicting Abbott Laboratories Stock Will Climb or Sink?,https://finance.yahoo.com/m/325cf171-a866-396f-ad9e-48ed5556b485/are-wall-street-analysts.html
2025-08-09 06:45:00,3 Stocks Retirees Should Absolutely Love,https://finviz.com/news/134309/3-stocks-retirees-should-absolutely-love
2025-08-08 09:39:00,Abbott's EPD Growth Beats Market Trends: Here's How to Play the Stock,https://finviz.com/news/133748/abbotts-epd-growth-beats-market-trends-heres-how-to-play-the-stock
2025-08-08 08:43:00,Hologic's Diagnostics Arm Set for Long-Term Upside: What's Behind It?,https://finviz.com/news/133589/hologics-diagnostics-arm-set-for-long-term-upside-whats-behind-it
2025-08-08 07:56:00,Gauzy Ltd. Announces Board of Directors Changes Following Annual Meeting,https://finance.yahoo.com/news/gauzy-ltd-announces-board-directors-115600537.html
2025-08-07 11:40:00,NVST vs. ABT: Which Stock Is the Better Value Option?,https://finviz.com/news/132280/nvst-vs-abt-which-stock-is-the-better-value-option
2025-08-07 10:16:00,"Influenza Vaccine Market Research Report 2025-2030 Featuring GSK, Abbott, Pfizer, AstraZeneca, Sanofi, Moderna, CSL, Emergent BioSolutions, BIKEN, Serum Institute of India, Sinovac, GC Biopharma",https://finance.yahoo.com/news/influenza-vaccine-market-research-report-141600698.html
2025-08-07 05:39:00,Inside Dexcoms strategy to stay ahead in the $13.6bn CGM market,https://finance.yahoo.com/m/26b568da-f6c1-3871-ad05-4515088d35a7/inside-dexcom%E2%80%99s-strategy-to.html
2025-08-06 16:05:00,Tandem Diabetes Care Announces Second Quarter 2025 Financial Results and Provides 2025 Annual Guidance,https://finance.yahoo.com/news/tandem-diabetes-care-announces-second-200500272.html
2025-08-06 16:05:00,"Senseonics Holdings, Inc. Reports Second Quarter Financial Results",https://finance.yahoo.com/news/senseonics-holdings-inc-reports-second-200500219.html
2025-08-06 09:00:00,Abbott Laboratories (ABT) Is a Trending Stock: Facts to Know Before Betting on It,https://finviz.com/news/129931/abbott-laboratories-abt-is-a-trending-stock-facts-to-know-before-betting-on-it
2025-08-06 07:41:00,Abbott's Q2 Diabetes Care Sales Rise 19.6%: What's Backing It?,https://finviz.com/news/129746/abbotts-q2-diabetes-care-sales-rise-196-whats-backing-it
2025-08-05 23:32:00,Medical Devices & Supplies - Diversified Stocks Q2 Highlights: Abbott Laboratories (NYSE:ABT),https://finviz.com/news/130389/medical-devices-supplies-diversified-stocks-q2-highlights-abbott-laboratories-nyse-abt
2025-08-01 08:15:00,2 Top Stocks to Buy Now If You Want Decades of Passive Income,https://finviz.com/news/124449/2-top-stocks-to-buy-now-if-you-want-decades-of-passive-income
2025-07-31 15:26:00,Analyst Report: AbbVie Inc.,https://finance.yahoo.com/m/9a386695-c245-34a1-a5d2-01eda6d10a46/analyst-report%3A-abbvie-inc..html
2025-07-31 00:23:00,UBS Shrugs Abbott Laboratories' (ABT) Diagnostic Weakness Affirms 'Buy' Rating,https://finviz.com/news/122110/ubs-shrugs-abbott-laboratories-abt-diagnostic-weakness-affirms-buy-rating
2025-07-30 05:08:00,"Drug Abuse Testing Market Forecast and Company Analysis Report 2025-2033 Featuring Danaher, LabCorp, Abbott, Quest Diagnostics, Thermo Fisher Scientific, F. Hoffmann-La Roche, Bio-Rad, Medtronic",https://finance.yahoo.com/news/drug-abuse-testing-market-forecast-090800366.html
2025-07-29 13:43:00,"Rapid Expansion and Innovation Drive $36 Billion Global Point-of-Care Diagnostics Market, Says New Kalorama Report",https://finance.yahoo.com/news/rapid-expansion-innovation-drive-36-174300653.html
2025-07-29 10:02:00,A new infant formula seven years in the making is hitting the $2 billion market,https://finance.yahoo.com/news/infant-formula-seven-years-making-140229998.html
2025-07-29 04:38:00,"Europe Defibrillator Market Forecast and Company Analysis Report 2025-2033 Featuring Medtronic, Philips, Nihon Kohden, Boston Scientific, Stryker, Asahi Kasei, LivaNova, and Abbott",https://finance.yahoo.com/news/europe-defibrillator-market-forecast-company-083800243.html
2025-07-29 04:31:00,"North America Autoimmune Disease Diagnostics Market Report 2025-2033 Featuring Bio-Rad, Abbott, Roche, Quest Diagnostics, Thermo Fisher Scientific, BioMerieux, Myriad Genetics, Siemens Healthineers",https://finance.yahoo.com/news/north-america-autoimmune-disease-diagnostics-083100056.html
2025-07-29 04:02:00,"Human Papilloma Virus Testing Market Research Report 2025-2033 Featuring Abbott Laboratories, BioMerieux, Bio-Rad Laboratories, Epigenomics, Siemens Healthineers, Hologic, Qiagen, F. Hoffmann-La Roche",https://finance.yahoo.com/news/human-papilloma-virus-testing-market-080200555.html
2025-07-28 08:09:00,Revvity trims 2025 profit forecast as China policy changes hit diagnostics demand,https://finance.yahoo.com/news/revvity-trims-2025-profit-forecast-120943976.html
2025-07-28 02:08:00,"Leerink Partners Decreases PT on Abbott Laboratories (ABT) to $136 From $143, Maintains a Hold Rating",https://finviz.com/news/116751/leerink-partners-decreases-pt-on-abbott-laboratories-abt-to-136-from-143-maintains-a-hold-rating
2025-07-28 01:42:00,RBC Capital Sees Strong Growth Potential for Abbott Laboratories (ABT),https://finviz.com/news/116730/rbc-capital-sees-strong-growth-potential-for-abbott-laboratories-abt
2025-07-27 15:00:00,A Data Deluge Brings a Moment of Truth for Markets This Week,https://finance.yahoo.com/news/data-deluge-brings-moment-truth-190000764.html
2025-07-25 23:50:00,Oversold Abbott Laboratories (ABT) Could Offer a Healthy Dividend Opportunity,https://finviz.com/news/116277/oversold-abbott-laboratories-abt-could-offer-a-healthy-dividend-opportunity
2025-07-25 19:00:00,5 Dividend Stocks to Hold for the Next 20 Years,https://finviz.com/news/116190/5-dividend-stocks-to-hold-for-the-next-20-years
2025-07-25 13:11:00,"HCA Beats Q2 Earnings on Higher Admissions, Ups '25 EPS View",https://finviz.com/news/116018/hca-beats-q2-earnings-on-higher-admissions-ups-25-eps-view
2025-07-25 11:13:00,"Venous Thromboembolism Treatment Devices Market Insights, Competitive Landscape, and Forecast Report 2032 Featuring Abbott, Boston Scientific, AngioDynamics, Argon Medical Devices, and Medtronic",https://finance.yahoo.com/news/venous-thromboembolism-treatment-devices-market-151300092.html
2025-07-25 05:27:00,"U.S. Acute External Ventricular Drain Market Analysis Report 2025-2030 Featuring Medtronic, Integra, LifeSciences, Anuncia Medical, Natus, Fuji Systems, B Braun/Aesculap, Boston Scientific, Abbott",https://finance.yahoo.com/news/u-acute-external-ventricular-drain-092700465.html
2025-07-24 09:38:00,Abbott Laboratories (ABT): A Bull Case Theory,https://finviz.com/news/113871/abbott-laboratories-abt-a-bull-case-theory
2025-07-24 09:06:00,Hologic's International Momentum Takes Shape: Will Execution Pay Off?,https://finviz.com/news/113978/hologics-international-momentum-takes-shape-will-execution-pay-off
2025-07-24 05:00:00,"The Zacks Analyst Blog Highlights Wells Fargo, Abbott Laboratories, American Express, TSS and Maui Land & Pineapple",https://finviz.com/news/113403/the-zacks-analyst-blog-highlights-wells-fargo-abbott-laboratories-american-express-tss-and-maui-land-pineapple
2025-07-23 17:06:00,"Top Stock Reports for Wells Fargo, Abbott & American Express",https://finviz.com/news/113000/top-stock-reports-for-wells-fargo-abbott-american-express
2025-07-23 10:54:00,"Jim Cramer Says He ""Was Discouraged to Get a Mixed Update from Abbott Labs""",https://finviz.com/news/112342/jim-cramer-says-he-was-discouraged-to-get-a-mixed-update-from-abbott-labs
2025-07-23 09:00:00,Investors Heavily Search Abbott Laboratories (ABT): Here is What You Need to Know,https://finviz.com/news/112131/investors-heavily-search-abbott-laboratories-abt-here-is-what-you-need-to-know
2025-07-23 04:30:00,"[Latest] Global Inferior Vena Cava IVC Filter Market Size/Share Worth USD 2,094.10 Million by 2034 at a 8.88% CAGR: Custom Market Insights (Analysis, Outlook, Leaders, Report, Trends, Forecast, Segmentation, Growth Rate, Value, SWOT)",https://finance.yahoo.com/news/latest-global-inferior-vena-cava-083000135.html
2025-07-22 13:30:00,"Tenet Beats Q2 Earnings on Strong Patient Volumes, Hikes '25 EPS View",https://finviz.com/news/111216/tenet-beats-q2-earnings-on-strong-patient-volumes-hikes-25-eps-view
2025-07-22 11:40:00,NVST or ABT: Which Is the Better Value Stock Right Now?,https://finviz.com/news/111085/nvst-or-abt-which-is-the-better-value-stock-right-now
2025-07-22 08:32:00,Is Hologic Stock a Risky Investment Ahead of Its Q3 Earnings Report?,https://finviz.com/news/110573/is-hologic-stock-a-risky-investment-ahead-of-its-q3-earnings-report
2025-07-22 08:30:00,Microbot Medical® Expands Commercial Leadership with Appointment of Christina Bailey as VP of Sales,https://finance.yahoo.com/news/microbot-medical-expands-commercial-leadership-123000496.html
2025-07-21 12:30:00,"[Latest] Global Cardiac Tissue Engineering Market Size/Share Worth USD 2,943.92 Million by 2034 at a 16.65% CAGR: Custom Market Insights (Analysis, Outlook, Leaders, Report, Trends, Forecast, Segmentation, Growth Rate, Value, SWOT Analysis)",https://finance.yahoo.com/news/latest-global-cardiac-tissue-engineering-163000002.html
2025-07-21 08:43:00,"Abbott Laboratories (ABT): I Am Very Upset With Abbott,"" Says Jim Cramer",https://finviz.com/news/109128/abbott-laboratories-abt-i-am-very-upset-with-abbott-says-jim-cramer
2025-07-21 06:13:00,Drugs of Abuse (DoA) Testing Market Opportunities and Strategies to 2034 | Strategic Acquisitions Boost Market Position of Leading DOA Testing Companies,https://finance.yahoo.com/news/drugs-abuse-doa-testing-market-101300865.html
2025-07-21 06:02:00,"India In Vitro Diagnostics (IVD) Industry Analysis & Forecast (2025-2034) Featuring Roche, Transasia Bio-Medicals, Bio-Rad Labs, BioMerieux, Sysmex, Abbott, Thermo Fisher Scientific, QIAGEN, Quidel, Danaher",https://finance.yahoo.com/news/india-vitro-diagnostics-ivd-industry-100200973.html
2025-07-21 05:22:00,"Cote d'Ivoire IVD Market Forecast Report 2025-2032 | Opportunities in Public-Private Partnerships, Molecular Diagnostics Demand, Telemedicine and Point-of-Care Testing",https://finance.yahoo.com/news/cote-divoire-ivd-market-forecast-092200918.html
2025-07-21 05:20:00,"Kenya IVD Market Research Report 2025-2032 | Opportunities in Increasing Adoption of Self-testing Kits, Emerging Technologies, Shift Towards Personalized Medicine, Integration of Digital Health",https://finance.yahoo.com/news/kenya-ivd-market-research-report-092000885.html
2025-07-20 00:15:00,Morningstar | A Weekly Summary of Stock Ideas and Developments in the Companies We Cover,https://finance.yahoo.com/m/507ecf59-ddd9-33e4-b5a5-f33983d90cd1/morningstar-%7C-a-weekly.html
2025-07-18 21:14:00,How Abbott Laboratories (ABT) Balances Innovation with Shareholder Payouts,https://finviz.com/news/108364/how-abbott-laboratories-abt-balances-innovation-with-shareholder-payouts
2025-07-18 20:44:00,Morningstar | A Weekly Summary of Stock Ideas and Developments in the Companies We Cover,https://finance.yahoo.com/m/100ccb71-8692-3f44-a4cb-f223208d4683/morningstar-%7C-a-weekly.html
2025-07-18 12:34:00,Why Abbott Laboratories Is a Q2 2025 Buy: Growth & Yield,https://finviz.com/news/108060/why-abbott-laboratories-is-a-q2-2025-buy-growth-yield
2025-07-18 11:01:00,Abbott Laboratories (ABT) Drops on Lower Full-Year Guidance,https://finviz.com/news/107990/abbott-laboratories-abt-drops-on-lower-full-year-guidance
2025-07-18 09:47:00,"Stock Market News for Jul 18, 2025",https://finviz.com/news/107947/stock-market-news-for-jul-18-2025
2025-07-18 09:40:00,Are Medical Stocks Lagging  Abbott Laboratories (ABT) This Year?,https://finviz.com/news/107905/are-medical-stocks-lagging-abbott-laboratories-abt-this-year
2025-07-18 09:38:00,"Snowflake initiated, Chipotle upgraded: Wall Street's top analyst calls",https://finance.yahoo.com/news/snowflake-initiated-chipotle-upgraded-wall-133817307.html
2025-07-18 09:35:00,"Down 9.0% in 4 Weeks, Here's Why Abbott (ABT) Looks Ripe for a Turnaround",https://finviz.com/news/107885/down-90-in-4-weeks-heres-why-abbott-abt-looks-ripe-for-a-turnaround
2025-07-18 09:03:00,"Abbott upgraded after post-earnings selloff, hardware drag seen temporary",https://finance.yahoo.com/news/abbott-upgraded-post-earnings-selloff-130319844.html
2025-07-18 03:08:00,Abbott Laboratories (ABT) Q2 2025 Earnings Call Highlights: Strong Growth in Medical Devices ...,https://finance.yahoo.com/news/abbott-laboratories-abt-q2-2025-070824915.html
2025-07-18 01:31:00,"ABT Q1 Deep Dive: Growth in Devices, Product Pipeline, and Tariff Mitigation Shape Outlook",https://finviz.com/news/107760/abt-q1-deep-dive-growth-in-devices-product-pipeline-and-tariff-mitigation-shape-outlook
2025-07-17 20:08:00,"Didn't see the recovery in China we were expecting, says Abbott Labs CEO on lowering guidance",https://www.youtube.com/watch?v=6_8CdJ4wJoM
2025-07-17 20:07:00,Analyst Report: Abbott Laboratories,https://finance.yahoo.com/m/464e0044-4bc3-3181-84a0-c23e962d9b8a/analyst-report%3A-abbott.html
2025-07-17 16:38:00,"These Stocks Moved the Most Today: Lucid, TSMC, Elevance, Sarepta, PepsiCo, Abbott Labs, Archer Daniels, and More",https://finance.yahoo.com/m/58c89238-3acf-35b4-af30-d0c4a9c9df1f/these-stocks-moved-the-most.html
2025-07-17 16:16:00,Abbott Laboratories Sheds 8% On A Rare Guidance Miss,https://www.investors.com/news/technology/abbott-stock-abbott-laboratories-earnings-q2-2025?mod=IBD_FV
2025-07-17 14:43:00,"These Stocks Are Moving the Most Today: Lucid, TSMC, Elevance, Sarepta, PepsiCo, Abbott Labs, Archer Daniels, and More",https://finance.yahoo.com/m/58c89238-3acf-35b4-af30-d0c4a9c9df1f/these-stocks-are-moving-the.html
2025-07-17 13:21:00,Why Abbott Laboratories (ABT) Shares Are Plunging Today,https://finviz.com/news/106993/why-abbott-laboratories-abt-shares-are-plunging-today
2025-07-17 12:59:00,"Biochip Market Global Outlook Report 2025, with Focus on Microarrays and Lab-on-a-Chip",https://finance.yahoo.com/news/biochip-market-global-outlook-report-165900112.html
2025-07-17 11:29:00,Abbott Earnings Beat Forecasts. Why the Stock Is Having Its Worst Day Since 2021.,https://finance.yahoo.com/m/4762823e-bdef-383c-9e56-0faf5852ac23/abbott-earnings-beat.html
2025-07-17 11:13:00,Abbott Narrows Its Outlook as COVID-19 Testing Demand Wanes. Its Stock Is Falling.,https://finance.yahoo.com/m/a122c708-740d-3f24-b7ba-4cb430c77339/abbott-narrows-its-outlook-as.html
2025-07-17 11:06:00,Abbott Stock Falls in Pre-Market Despite Q2 Earnings and Sales Beat,https://finviz.com/news/106882/abbott-stock-falls-in-pre-market-despite-q2-earnings-and-sales-beat
2025-07-17 10:48:00,Eased Tariff Impact Fails To Lift Abbott As Outlook Cut Disappoints Investors,https://finance.yahoo.com/news/eased-tariff-impact-fails-lift-144815504.html
2025-07-17 10:11:00,"GE Aerospace, Abbott Labs, Elevance: Trending Tickers",https://finance.yahoo.com/video/ge-aerospace-abbott-labs-elevance-141102673.html
2025-07-17 09:30:00,Abbott (ABT) Reports Q2 Earnings: What Key Metrics Have to Say,https://finviz.com/news/106623/abbott-abt-reports-q2-earnings-what-key-metrics-have-to-say
2025-07-17 08:40:00,Abbott (ABT) Q2 Earnings and Revenues Top Estimates,https://finviz.com/news/106506/abbott-abt-q2-earnings-and-revenues-top-estimates
2025-07-17 08:16:00,Abbott Labs Stock Dives After Earnings Miss. Why Rising Sales Fail to Lift Shares.,https://www.barrons.com/articles/abbott-labs-earnings-stock-price-9aeca4b0?mod=bar_FV
2025-07-17 08:13:00,Abbotts Q2 revenue tops expectations but shares fall,https://finance.yahoo.com/news/abbott-q2-revenue-tops-expectations-121325840.html
2025-07-17 08:05:00,"Abbott Labs Pares Outlook After Profit, Sales Gains",https://www.wsj.com/business/earnings/abbott-labs-pares-outlook-after-profit-sales-gains-26163bca?mod=wsj_FV
2025-07-17 07:44:00,Abbott Laboratories's (NYSE:ABT) Q2 Sales Top Estimates,https://finviz.com/news/106247/abbott-laboratoriess-nyse-abt-q2-sales-top-estimates
2025-07-17 07:37:00,Abbott: Q2 Earnings Snapshot,https://finance.yahoo.com/news/abbott-q2-earnings-snapshot-113747662.html
2025-07-17 07:33:00,"Abbott beats profit estimates on medical devices demand, shares fall on forecast",https://finance.yahoo.com/news/abbott-beats-quarterly-profit-estimates-113349373.html
2025-07-17 07:30:00,Abbott Reports Second-Quarter 2025 Results,https://finviz.com/news/106226/abbott-reports-second-quarter-2025-results
2025-07-17 06:05:00,US stock futures little changed as investors await earnings reports,https://finance.yahoo.com/m/ac96aaf6-dc3c-368d-ac9f-6a042737405b/us-stock-futures-little.html
2025-07-17 05:08:00,"Stocks to Watch Thursday: TSMC, United Airlines, Sarepta, ADM",https://finance.yahoo.com/m/b17610df-2730-3932-9797-d25895a8516d/stocks-to-watch-thursday%3A.html
2025-07-17 03:46:00,"Netflix Earnings, Consumer Sentiment, Retail Sales: Still to Come This Week",https://finance.yahoo.com/m/65208885-32e5-36bb-8d38-95f355d01824/netflix-earnings%2C-consumer.html
2025-07-16 19:00:00,"Netflix & TSMC earnings, retail sales, Fed talk: What to Watch",https://finance.yahoo.com/video/netflix-tsmc-earnings-retail-sales-230032322.html
2025-07-16 18:02:00,"Markets Fight Off Powell Rumor, Close in the Green",https://finviz.com/news/105969/markets-fight-off-powell-rumor-close-in-the-green
2025-07-16 17:45:00,"Earnings, Consumer Sentiment, Retail Sales: Still to Come This Week",https://finance.yahoo.com/m/c221f2fe-8a5d-3493-a31b-45d1d8fcf0db/earnings%2C-consumer-sentiment%2C.html
