datetime,headline,url
Aug-13-25 Today 09:39AM,"Saudi Arabia Cloud Computing Market Outlook and Company Analysis Report 2025-2033 Featuring Google, AWS,  Alibaba, Microsoft, Oracle, CloudSigma, VMware, Salesforce, Saudi Telecom Co, IBM",https://finance.yahoo.com/news/saudi-arabia-cloud-computing-market-133900479.html
2025-08-13 09:30:00,Copado Launches Org Intelligence to Provide End-to-End Visibility into Salesforce Environments,https://finance.yahoo.com/news/copado-launches-org-intelligence-end-133000298.html
2025-08-13 09:00:00,Salesforce Inc. (CRM) is Attracting Investor Attention: Here is What You Should Know,https://finviz.com/news/139212/salesforce-inc-crm-is-attracting-investor-attention-here-is-what-you-should-know
2025-08-13 09:00:00,Sprout Social Launches Expansive Suite of Integrations to Empower Brands in the Social Intelligence Era,https://finance.yahoo.com/news/sprout-social-launches-expansive-suite-130000184.html
2025-08-13 08:30:00,Sapiens (SPNS) Surpasses Q2 Earnings and Revenue Estimates,https://finviz.com/news/139148/sapiens-spns-surpasses-q2-earnings-and-revenue-estimates
2025-08-13 07:05:00,"AcuityMD Makes the Forbes 2025 ""Next Billion-Dollar Startups"" List",https://finance.yahoo.com/news/acuitymd-makes-forbes-2025-next-110500304.html
2025-08-13 06:04:00,How the unraveling of two Pentagon projects may result in a costly do-over,https://finance.yahoo.com/news/unraveling-two-pentagon-projects-may-100451267.html
2025-08-12 12:02:00,Faye Named to Accounting Today's 2025 VAR 100 List for Leading VAR Excellence,https://finance.yahoo.com/news/faye-named-accounting-todays-2025-160200385.html
2025-08-12 12:00:00,"ValueSelling Associates Unveils AI Enhancement to eValuePrompter, Deepening Salesforce Integration and Empowering Sellers with Intelligent Workflows",https://finance.yahoo.com/news/valueselling-associates-unveils-ai-enhancement-160000912.html
2025-08-12 11:05:00,NiCE Deepens Partnership with Salesforce to Accelerate End-To-End Customer Service Workflow Orchestration,https://finance.yahoo.com/news/nice-deepens-partnership-salesforce-accelerate-150500440.html
2025-08-12 10:48:00,Billions wiped out as software stocks sink on AI disruption fear,https://finance.yahoo.com/news/billions-wiped-software-stocks-sink-144849751.html
2025-08-12 10:00:00,Dealops Raises $7 Million to Power Pricing in the AI Era,https://finance.yahoo.com/news/dealops-raises-7-million-power-140000855.html
2025-08-12 09:00:00,Exclusive: Profound raises $35M as Sequoia backs its ambitious bid to become the Salesforce of AI search,https://finance.yahoo.com/news/exclusive-profound-raises-35m-sequoia-130000648.html
2025-08-12 09:00:00,Accounting Seed Makes the Inc. 5000 for the Sixth Consecutive Year,https://finance.yahoo.com/news/accounting-seed-makes-inc-5000-130000958.html
2025-08-12 08:52:00,Software stocks in Europe fall on concerns over AI pitfalls,https://finance.yahoo.com/news/software-stocks-europe-fall-concerns-125255954.html
2025-08-11 19:00:00,"Seoul-based Datumo raises $15.5M to take on Scale AI, backed by Salesforce",https://finance.yahoo.com/news/seoul-based-datumo-raises-15-230000680.html
2025-08-11 17:45:00,Salesforce.com (CRM) Falls More Steeply Than Broader Market: What Investors Need to Know,https://finviz.com/news/135792/salesforcecom-crm-falls-more-steeply-than-broader-market-what-investors-need-to-know
2025-08-11 17:18:00,Adobe Stock Downgraded As 'AI Is Eating Software',https://finance.yahoo.com/m/d805b4a5-cc7f-382a-a6b2-10bd36133a1b/adobe-stock-downgraded-as-%27ai.html
2025-08-11 16:51:00,"Stock Market Today: Dow, Nasdaq Fall, Set Aside Trump-China Tariff Move; Tesla Clears Entry But This AI Stock Craters",https://finance.yahoo.com/m/e2020f85-4acd-3b1e-ba61-a0a1e19394be/stock-market-today%3A-dow%2C.html
2025-08-11 13:37:00,"Stock Market Today: Dow Swoons But Nasdaq Shines As Tesla Clears Entry; AMC Stock Surges, But Consider This (Live Coverage)",https://finance.yahoo.com/m/e2020f85-4acd-3b1e-ba61-a0a1e19394be/stock-market-today%3A-dow.html
2025-08-11 12:42:00,"Adobe Stock Gets a Downgrade. AI Is Eating Software, Analyst Says.",https://finance.yahoo.com/m/c94c0605-31ee-3c39-be0f-89af0628c34a/adobe-stock-gets-a-downgrade..html
2025-08-11 11:11:00,Melius Research warns that things can get worse for SaaS players like Adobe,https://finance.yahoo.com/news/melius-research-warns-things-worse-151114488.html
2025-08-11 09:10:00,Salesforce Stock Plunges 28% YTD: Should You Exit the Investment?,https://finviz.com/news/135146/salesforce-stock-plunges-28-ytd-should-you-exit-the-investment
2025-08-11 08:00:00,Bank of America Securities Reaffirms Buy Rating on Salesforce (CRM) Stock,https://finviz.com/news/134828/bank-of-america-securities-reaffirms-buy-rating-on-salesforce-crm-stock
2025-08-11 07:46:00,Genesys Announces $1.5 Billion in New Investment Commitments from Salesforce (CRM) and ServiceNow (NOW),https://finviz.com/news/134805/genesys-announces-15-billion-in-new-investment-commitments-from-salesforce-crm-and-servicenow-now
2025-08-11 06:00:00,"Salesforce, PayPal COFOs tout agentic AI potential: Trial Balance",https://finance.yahoo.com/m/4a385e8d-990d-3fe7-9a2a-49a276616bd4/salesforce%2C-paypal-cofos-tout.html
2025-08-11 05:41:00,"These 3 Artificial Intelligence (AI) Stocks Could Soar More Than 40% Over the Next 12 Months, According to Wall Street",https://finviz.com/news/134654/these-3-artificial-intelligence-ai-stocks-could-soar-more-than-40-over-the-next-12-months-according-to-wall-street
2025-08-11 04:58:00,How Salesforces finance chief is leveraging AI,https://finance.yahoo.com/m/392fd988-35ca-3e38-9340-3e4ac68e42a9/how-salesforce%E2%80%99s-finance.html
2025-08-11 04:25:00,"1 Popular AI Stock to Sell Before It Falls 17%, According to Wall Street Analysts (Hint: It's Not Nvidia)",https://finviz.com/news/134606/1-popular-ai-stock-to-sell-before-it-falls-17-according-to-wall-street-analysts-hint-its-not-nvidia
2025-08-11 00:30:00,AI Won't Kill Software. It Will Simply Give It New Life.,https://www.barrons.com/articles/ai-chatgpt-software-salesforce-adobe-8f9da064?mod=bar_FV
2025-08-10 00:00:00,"Jim Cramer on Salesforce: ""I Want to See What Happens With the Quarter""",https://finviz.com/news/134457/jim-cramer-on-salesforce-i-want-to-see-what-happens-with-the-quarter
2025-08-08 17:00:00,3 No-Brainer Artificial Intelligence (AI) Stocks to Buy Now and Hold Forever,https://finviz.com/news/134179/3-no-brainer-artificial-intelligence-ai-stocks-to-buy-now-and-hold-forever
2025-08-08 16:28:00,"These Stocks Moved the Most Today: Trade Desk, Expedia, SoundHound, Pinterest, Gilead, Peloton, and More",https://finance.yahoo.com/m/5cbe4f69-28be-36c0-8426-7cacb941d8d4/these-stocks-moved-the-most.html
2025-08-08 13:27:00,"These Stocks Are Moving Most Today: Trade Desk, Expedia, SoundHound, Pinterest, Gilead, Microchip, and More",https://finance.yahoo.com/m/5cbe4f69-28be-36c0-8426-7cacb941d8d4/these-stocks-are-moving-most.html
2025-08-08 10:15:00,Sports Analytics Market worth $4.75 billion by 2030 | MarketsandMarkets,https://finance.yahoo.com/news/sports-analytics-market-worth-4-141500027.html
2025-08-08 06:45:00,Trade Desk Stock Crashes 30% After Earnings. What's Causing the Selloff.,https://www.barrons.com/articles/trade-desk-earnings-stock-price-27a3dbcc?mod=bar_FV
2025-08-08 06:13:00,"Ecommerce Platform Market Analysis and Global Forecast Report 2025-2030 | Omnichannel Retailing to Drive Demand, Internet Penetration and Smartphones Fuel Adoption",https://finance.yahoo.com/news/ecommerce-platform-market-analysis-global-101300407.html
2025-08-07 16:45:00,"Trade Desk falls sharply on narrow Q2 beat, in-line guidance",https://finance.yahoo.com/news/trade-desk-beat-q2-per-204507588.html
2025-08-07 16:10:00,Salesforce Announces Timing of its Second Quarter Fiscal 2026 Results Conference Call,https://finance.yahoo.com/news/salesforce-announces-timing-second-quarter-201000770.html
2025-08-07 16:01:00,The Trade Desk Reports Second Quarter 2025 Financial Results,https://finance.yahoo.com/news/trade-desk-reports-second-quarter-200100677.html
2025-08-07 16:01:00,The Trade Desk Announces Alex Kayyal as New Chief Financial Officer,https://finance.yahoo.com/news/trade-desk-announces-alex-kayyal-200100660.html
2025-08-07 15:45:00,Dow's biggest drags are from three very different sectors,https://www.marketwatch.com/livecoverage/stock-market-today-dow-s-p500-nasdaq-called-higher-as-trump-tariffs-take-effect-apple-bounces/card/dow-s-biggest-drags-are-from-three-very-different-sectors-5kekh3et64yyW8wyydFE?mod=mw_FV
2025-08-07 13:34:00,"Any pullback in stocks 'gives investors a reason to be on edge,' portfolio manager says",https://www.marketwatch.com/livecoverage/stock-market-today-dow-s-p500-nasdaq-called-higher-as-trump-tariffs-take-effect-apple-bounces/card/any-pullback-in-stocks-gives-investors-a-reason-to-be-on-edge-portfolio-manager-says-ayL1TnNvKoUE1G4HDATS?mod=mw_FV
2025-08-07 12:39:00,Salesforce (CRM) to Acquire Bluebirds,https://finviz.com/news/132257/salesforce-crm-to-acquire-bluebirds
2025-08-07 10:54:00,Suddenly the Dow Is Down. Blame Healthcare Stocks.,https://finance.yahoo.com/m/12eef28e-52c2-343d-8a00-06e19607dc3b/suddenly-the-dow-is-down..html
2025-08-07 09:00:00,Sprout Social Expands Salesforce Collaboration to Revolutionize Social Customer Care,https://finance.yahoo.com/news/sprout-social-expands-salesforce-collaboration-130000645.html
2025-08-07 09:00:00,Encryption-In-Use Technology Would Have Neutralized the Allianz Life Insurance Breach,https://finance.yahoo.com/news/encryption-technology-neutralized-allianz-life-130000095.html
2025-08-07 07:15:00,ACI Worldwide (ACIW) Tops Q2 Earnings and Revenue Estimates,https://finviz.com/news/131617/aci-worldwide-aciw-tops-q2-earnings-and-revenue-estimates
2025-08-07 04:48:00,Salesforce Stock: Is Wall Street Bullish or Bearish?,https://finance.yahoo.com/m/3c613958-5ed1-3f41-a63c-4dae67583a95/salesforce-stock%3A-is-wall.html
2025-08-07 00:34:00,3 Out-of-Favor Stocks We Find Risky,https://finviz.com/news/133042/3-out-of-favor-stocks-we-find-risky
2025-08-06 20:27:00,"Lightning Round: Oklo is a good company, says Jim Cramer",https://www.youtube.com/watch?v=Bw7zbPOBZzU
2025-08-06 19:30:00,"Zenity Labs Exposes Widespread ""AgentFlayer"" Vulnerabilities Allowing Silent Hijacking of Major Enterprise AI Agents Circumventing Human Oversight",https://finance.yahoo.com/news/zenity-labs-exposes-widespread-agentflayer-233000836.html
2025-08-06 18:02:00,Salesforce Deal 'A Recipe For Value': Informatica CEO,https://finance.yahoo.com/video/salesforce-deal-recipe-value-informatica-220254711.html
2025-08-06 16:05:00,Informatica Reports Second Quarter 2025 Financial Results,https://finance.yahoo.com/news/informatica-reports-second-quarter-2025-200500461.html
2025-08-06 15:21:00,Why Oracle Stock and 2 Other Software Plays Are Struggling Even as Tech Shares Rally,https://www.barrons.com/articles/orcale-stock-price-software-struggle-f242c9f6?mod=bar_FV
2025-08-06 10:01:00,AI Platform Market $94.30 billion by 2030 | MarketsandMarkets,https://finance.yahoo.com/news/ai-platform-market-94-30-140100167.html
2025-08-06 09:07:00,Arthur D. Little Signs Five-Year Renewal with Kantata to Power Global Business Transformation,https://finance.yahoo.com/news/arthur-d-little-signs-five-130700376.html
2025-08-06 08:05:00,Google says hackers stole its customers data by breaching its Salesforce database,https://finance.yahoo.com/news/google-says-hackers-stole-customers-120525867.html
2025-08-06 07:00:00,Bear Call Spread Ideas for Salesforce Earnings,https://finance.yahoo.com/m/12280458-14aa-32f1-abe5-c1a9c4d80001/bear-call-spread-ideas-for.html
2025-08-06 04:57:00,Palantir Is Now a $400 Billion-Plus Company,https://finance.yahoo.com/m/8b1b428b-6a73-385e-929c-50c74b56d501/palantir-is-now-a-%24400.html
2025-08-05 17:45:00,Here's Why Salesforce.com (CRM) Fell More Than Broader Market,https://finviz.com/news/128986/heres-why-salesforcecom-crm-fell-more-than-broader-market
2025-08-05 11:49:00,Palantir's stock heads for a market-cap milestone just months after its last one,https://www.marketwatch.com/livecoverage/stock-market-today-dow-s-p500-nasdaq-extend-rebound-as-bond-yields-steady-palantir-earnings/card/palantir-s-stock-heads-for-a-market-cap-milestone-just-months-after-its-last-one-Fz5MAi42icQ64f2XrjBi?mod=mw_FV
2025-08-05 11:03:00,Hacker used a voice phishing attack to steal Cisco customers personal information,https://finance.yahoo.com/news/hacker-used-voice-phishing-attack-150303366.html
2025-08-05 10:34:00,"AI for Sales and Marketing Company Evaluation Report 2025 | Salesforce, Google, and Adobe Lead with Advanced Personalization, Predictive Analytics, and Marketing Automation",https://finance.yahoo.com/news/ai-sales-marketing-company-evaluation-143400946.html
2025-08-05 08:00:00,Concentric AI Introduces Industry-First Integrations that Enhance Capabilities of its AI-Driven Data Security Governance Platform,https://finance.yahoo.com/news/concentric-ai-introduces-industry-first-120000811.html
2025-08-05 07:00:00,Asymbl Expands Senior Leadership to Scale Execution and Sustain Accelerated Growth,https://finance.yahoo.com/news/asymbl-expands-senior-leadership-scale-110000890.html
2025-08-05 06:00:00,"Monte Carlo First Data + AI Observability Company to Launch Native Integrations with Salesforce to Ensure Reliable, AI-Ready Customer Data",https://finance.yahoo.com/news/monte-carlo-first-data-ai-100000334.html
2025-08-04 16:04:00,Weave Names Abhi Sharma as Chief Technology Officer,https://finance.yahoo.com/news/weave-names-abhi-sharma-chief-200400452.html
2025-08-04 12:30:00,John Hinshaw Joins Digile as Strategic Advisor & Mentor to Accelerate AI-Led Growth and Global Expansion,https://finance.yahoo.com/news/john-hinshaw-joins-digile-strategic-163000511.html
2025-08-04 10:30:00,CloudMasonry Announces Salesforce Marketing Cloud Next Focused Team,https://finance.yahoo.com/news/cloudmasonry-announces-salesforce-marketing-cloud-143000157.html
2025-08-04 10:15:00,AI SDR Market $15.01 billion by 2030 | MarketsandMarkets,https://finance.yahoo.com/news/ai-sdr-market-15-01-141500537.html
2025-08-04 08:27:00,"Buy Mid-Cap AI Stock FIVN on Solid Q2 Earnings, Outlook & Valuation",https://finviz.com/news/126242/buy-mid-cap-ai-stock-fivn-on-solid-q2-earnings-outlook-valuation
2025-08-04 07:00:00,How Seismics CFO-CRO partnership sustains growth after profitability,https://finance.yahoo.com/m/f861aa7c-0ecb-37f8-8b50-fd4ac5d4c535/how-seismic%E2%80%99s-cfo-cro.html
2025-08-02 04:30:00,5 Cheap Tech Stocks to Buy Right Now,https://finviz.com/news/125382/5-cheap-tech-stocks-to-buy-right-now
2025-08-01 16:51:00,Figma's IPO success could push Canva and these other software companies to go public,https://www.marketwatch.com/story/figmas-ipo-success-could-push-canva-and-these-other-software-companies-to-go-public-8ceb08fb?mod=mw_FV
2025-08-01 11:58:00,CRM vs. NOW: Which Workflow Automation Stock Has More Upside?,https://finviz.com/news/125013/crm-vs-now-which-workflow-automation-stock-has-more-upside
2025-08-01 09:00:00,Salesforce Inc. (CRM) Is a Trending Stock: Facts to Know Before Betting on It,https://finviz.com/news/124593/salesforce-inc-crm-is-a-trending-stock-facts-to-know-before-betting-on-it
2025-08-01 08:00:00,Veeva Systems Stock Is Up Nearly 40% This Year And Approaching A Buy Point,https://finance.yahoo.com/m/0bc5327b-0180-3574-90d9-4fe072e961ca/veeva-systems-stock-is-up.html
2025-08-01 07:10:00,CDW Names Mukesh Kumar Chief Services and Solutions Officer,https://finance.yahoo.com/news/cdw-names-mukesh-kumar-chief-111000727.html
2025-08-01 06:40:00,"AI Agents Company Evaluation Report 2025 | OpenAI, Google, and AWS Lead with Enterprise Integration, Developer Ecosystems, and Cloud-Native Innovations",https://finance.yahoo.com/news/ai-agents-company-evaluation-report-104000650.html
2025-07-31 16:28:00,"IBD Stock Of The Day, Snowflake, On Artificial Intelligence Fast Track",https://finance.yahoo.com/m/7258768f-c724-3510-8e39-41e446cca9b7/ibd-stock-of-the-day%2C.html
2025-07-31 16:05:00,Genesys Announces $1.5 Billion Investment by Salesforce and ServiceNow,https://finance.yahoo.com/news/genesys-announces-1-5-billion-200500177.html
2025-07-31 10:01:00,"Cloud OSS BSS Market worth $56,848.3 million by 2030 | MarketsandMarkets",https://finance.yahoo.com/news/cloud-oss-bss-market-worth-140100235.html
2025-07-31 09:55:00,"Insurance Platform Company Evaluation Report 2025 | Salesforce, Microsoft, and SAP Drive Innovation with AI-Powered CRM, Cloud Infrastructure, and Scalable Policy Solutions",https://finance.yahoo.com/news/insurance-platform-company-evaluation-report-135500611.html
2025-07-30 17:20:00,PTC Inc. (PTC) Beats Q3 Earnings and Revenue Estimates,https://finviz.com/news/121764/ptc-inc-ptc-beats-q3-earnings-and-revenue-estimates
2025-07-30 13:42:00,Why Dividend Investors Should Watch Salesforce's (CRM) Innovation Edge,https://finviz.com/news/121408/why-dividend-investors-should-watch-salesforces-crm-innovation-edge
2025-07-30 13:34:00,Strong Cloud Subscription Aids PEGA's Prospects: What's More to Come?,https://finviz.com/news/121465/strong-cloud-subscription-aids-pegas-prospects-whats-more-to-come
2025-07-30 12:35:00,What to Expect From Salesforce's Next Quarterly Earnings Report,https://finance.yahoo.com/m/b72fafe1-ffd1-3caf-8fc5-113d77605350/what-to-expect-from.html
2025-07-30 12:18:00,NOW's Subscription Growth Picks Up: A Sign of More Upside?,https://finviz.com/news/121396/nows-subscription-growth-picks-up-a-sign-of-more-upside
2025-07-30 11:55:00,DocuSign vs. Spotify: Which Digital Pioneer Delivers More Value?,https://finviz.com/news/121361/docusign-vs-spotify-which-digital-pioneer-delivers-more-value
2025-07-30 11:44:00,Salesforce CEO Marc Benioff on why AI agents wont lead to mass unemployment,https://finance.yahoo.com/news/salesforce-ceo-marc-benioff-why-154430631.html
2025-07-30 09:00:00,CoLab Adds Experienced Growth-Stage CFO Jake Kornreich to Executive Team,https://finance.yahoo.com/news/colab-adds-experienced-growth-stage-130000327.html
2025-07-30 09:00:00,AutoRABIT Appoints Cybersecurity Veteran Patrick Sweeney as CEO to Lead the Company Into Its Next Phase of Growth,https://finance.yahoo.com/news/autorabit-appoints-cybersecurity-veteran-patrick-130000915.html
2025-07-29 17:45:00,Salesforce.com (CRM) Declines More Than Market: Some Information for Investors,https://finviz.com/news/119840/salesforcecom-crm-declines-more-than-market-some-information-for-investors
2025-07-29 17:14:00,"Freshworks CEO talks Q2 earnings, AI, and taking on the software giants",https://finance.yahoo.com/video/freshworks-ceo-talks-q2-earnings-211436714.html
2025-07-29 16:58:00,Why the man behind 'The Hater's Guide to the AI Bubble' thinks Wall Street's hottest trade will go bust,https://www.marketwatch.com/story/why-the-man-behind-the-haters-guide-to-the-ai-bubble-thinks-wall-streets-hottest-trade-will-go-bust-ac398ce0?mod=mw_FV
2025-07-29 16:16:00,Freshworks raises annual revenue forecast on AI-driven demand,https://finance.yahoo.com/news/freshworks-raises-annual-revenue-forecast-201653987.html
2025-07-29 10:22:00,Salesforce Stock Outlook: A Strong Business at a Discounted Price,https://finance.yahoo.com/news/salesforce-stock-outlook-strong-business-105721461.html
2025-07-29 09:04:00,Cloud for Good Accelerates Global Innovation Strategy with Launch of Delivery Hub in India,https://finance.yahoo.com/news/cloud-good-accelerates-global-innovation-130400060.html
2025-07-29 09:00:00,Winners in Second Annual Stevie® Awards for Technology Excellence Announced,https://finance.yahoo.com/news/winners-second-annual-stevie-awards-130000113.html
